{
  "$schema": "https://json-schema.org/draft/2020-12/schema",
  "$id": "https://github.com/Sogni-AI/sogni-worlds-kit/schema/world.schema.json",
  "title": "Sogni World (world.json)",
  "description": "A finished, playable world. `node world build` writes it; the player reads it. Media paths are relative to this file, or absolute https URLs.",
  "type": "object",
  "required": ["format", "id", "title", "aspect", "start", "places"],
  "additionalProperties": false,
  "properties": {
    "format": { "const": "sogni-world@1" },
    "id": { "type": "string", "pattern": "^[a-z0-9][a-z0-9-]*$" },
    "title": { "type": "string" },
    "subtitle": { "type": "string" },
    "credit": { "type": "string", "description": "Shown in the About panel, e.g. who made it and how." },
    "aspect": {
      "type": "object",
      "description": "The shape every place is shown at (the stills' and films' width and height).",
      "required": ["width", "height"],
      "properties": { "width": { "type": "integer", "minimum": 1 }, "height": { "type": "integer", "minimum": 1 } },
      "additionalProperties": false
    },
    "start": { "type": "string", "description": "The id of the first place." },
    "order": {
      "type": ["array", "null"],
      "items": { "type": "string" },
      "description": "A story told in order: the place ids in sequence. The player offers each place's next stop first and marks the rest as shortcuts. null for a free-roaming world."
    },
    "music": {
      "type": ["object", "null"],
      "required": ["src"],
      "additionalProperties": false,
      "properties": {
        "src": { "type": "string" },
        "volume": { "type": "number", "minimum": 0, "maximum": 4, "description": "Relative level; 1 is as mastered." },
        "underFilms": { "type": "number", "minimum": 0, "maximum": 1, "description": "Multiplier while a film or narration plays." },
        "credit": { "type": "string" }
      }
    },
    "speakers": {
      "type": "object",
      "description": "Optional avatars for narration speakers, keyed by the name used in narration lines.",
      "additionalProperties": {
        "type": "object",
        "properties": { "avatar": { "type": "string" } },
        "additionalProperties": false
      }
    },
    "intro": {
      "type": "object",
      "description": "The Begin card's words. Every field is optional; the defaults suit a photo world.",
      "additionalProperties": false,
      "properties": {
        "eyebrow": { "type": "string", "description": "Small line above the title (default \"A Sogni World\")." },
        "tagline": { "type": "string", "description": "A line or two under the title." },
        "warning": { "type": "string", "description": "A content note on the card, e.g. for an 18+ world." },
        "begin": { "type": "string", "description": "The Begin button's words." }
      }
    },
    "map": { "type": "boolean", "description": "false hides the Places panel (a world with secrets or fatal choices). Default true." },
    "draft": { "type": "boolean", "description": "true when the build used takes nobody has approved yet (`node world build --drafts`); the player says so." },
    "places": { "type": "array", "minItems": 1, "items": { "$ref": "#/$defs/place" } }
  },
  "$defs": {
    "film": {
      "type": "object",
      "required": ["src"],
      "additionalProperties": false,
      "properties": {
        "src": { "type": "string", "description": "The full-size film (2K class): H.264 MP4, CRF 23 capped by size (12 Mbps at 2K), a keyframe every 2 s, fast start." },
        "src720": { "type": "string", "description": "An exact half-size copy for phones and slow connections, under its own size's cap." },
        "seconds": { "type": "number" }
      }
    },
    "place": {
      "type": "object",
      "required": ["id", "title", "still", "hotspots"],
      "additionalProperties": false,
      "properties": {
        "id": { "type": "string" },
        "title": { "type": "string" },
        "chapter": { "type": "string" },
        "caption": { "type": "string", "description": "One line shown on arrival." },
        "still": { "type": "string", "description": "The canonical still, as WebP. Every film that starts or ends here starts or ends on exactly this picture." },
        "loop": { "oneOf": [{ "$ref": "#/$defs/film" }, { "type": "null" }], "description": "The living photograph: plays over the still, starting and ending on it." },
        "music": { "oneOf": [{ "$ref": "#/$defs/music" }, { "type": "null" }], "description": "The track under this place, in place of the world's while you are here; null for silence here. Absent, the world's track carries on." },
        "narration": {
          "type": ["object", "null"],
          "required": ["lines"],
          "additionalProperties": false,
          "properties": {
            "src": { "type": "string", "description": "Optional audio; without it the lines show at reading pace." },
            "lines": {
              "type": "array",
              "items": {
                "type": "object",
                "required": ["text"],
                "additionalProperties": false,
                "properties": {
                  "text": { "type": "string" },
                  "speaker": { "type": "string" },
                  "start": { "type": "number" },
                  "end": { "type": "number" }
                }
              }
            }
          }
        },
        "ending": {
          "type": ["object", "null"],
          "description": "This place ends the story: a death (Rewind chooses again) or an ending. The player shows its card on arrival.",
          "required": ["kind", "title"],
          "additionalProperties": false,
          "properties": {
            "kind": { "enum": ["death", "end"] },
            "title": { "type": "string" },
            "text": { "type": "string" }
          }
        },
        "hotspots": { "type": "array", "items": { "$ref": "#/$defs/hotspot" } }
      }
    },
    "hotspot": {
      "type": "object",
      "required": ["id", "label", "at"],
      "description": "Every hotspot has a film, except a collectible with a figure, which may be picked up straight from the picture.",
      "if": { "properties": { "collect": { "const": true }, "figure": { "type": "object" } }, "required": ["collect", "figure"] },
      "else": { "required": ["film"] },
      "additionalProperties": false,
      "properties": {
        "id": { "type": "string" },
        "label": { "type": "string", "description": "What happens when you click, as an action: \"Duck through the round door\"." },
        "hint": { "type": "string" },
        "at": {
          "type": "array", "items": { "type": "number", "minimum": 0, "maximum": 1 }, "minItems": 2, "maxItems": 2,
          "description": "Where the label sits, as fractions of the picture's width and height: beside the object, not on it."
        },
        "outline": {
          "type": ["object", "null"],
          "required": ["width", "height", "path"],
          "additionalProperties": false,
          "description": "The object's traced SAM 3 outline: an SVG path in a width × height coordinate space that covers the whole picture.",
          "properties": { "width": { "type": "number" }, "height": { "type": "number" }, "path": { "type": "string" } }
        },
        "to": { "type": ["string", "null"], "description": "The place this crossing lands on; null for a moment that returns here." },
        "next": { "type": "boolean", "description": "In a story told in order, this is the way to the next stop." },
        "shortcut": { "type": "boolean", "description": "A crossing that jumps out of the story's order, offered as an easter egg." },
        "collect": { "type": "boolean", "description": "A collectible: its moment plays (or, with a figure and no film, it is picked up straight away), then it joins the visitor's collection (kept in their browser). Never has \"to\"." },
        "figure": {
          "type": ["object", "null"],
          "description": "A 3D figure (Pixal3D GLB) the visitor turns over after the film. A collectible's figure also appears in their collection; without collect it is only turned over.",
          "required": ["model"],
          "additionalProperties": false,
          "properties": {
            "model": { "type": "string", "description": "The GLB, relative to world.json." },
            "icon": { "type": "string", "description": "The object cut out on transparency (WebP, or a PNG of 512 px or less): its picture in the collection." },
            "name": { "type": "string", "description": "What it is called in the collection." }
          }
        },
        "details": {
          "type": ["object", "null"],
          "description": "A card about the object, shown beside its film until the visitor closes it or moves on: what a hotel room's sauna is, a home's view, a product's specifications.",
          "required": ["text"],
          "additionalProperties": false,
          "properties": {
            "title": { "type": "string" },
            "text": { "type": "string", "description": "A sentence or two about it." },
            "facts": { "type": "array", "items": { "type": "array", "items": { "type": "string" }, "minItems": 2, "maxItems": 2 }, "description": "[label, value] pairs: [\"Session\", \"30–60 minutes\"]." }
          }
        },
        "film": { "$ref": "#/$defs/film" },
        "reveal": {
          "type": ["object", "null"],
          "description": "A close look, never with \"to\": the film lands on still (its last frame) and the player holds there while narration is said and a figure is turned over; the done button plays back, a film from still to the place's still.",
          "required": ["still", "back"],
          "additionalProperties": false,
          "properties": {
            "still": { "type": "string", "description": "The close look, as WebP: the film's last frame and the film back's first." },
            "narration": { "$ref": "#/$defs/place/properties/narration" },
            "done": { "type": "string", "description": "The button that ends the close look (default \"Continue\", or \"Put it down\" with a figure)." },
            "back": { "$ref": "#/$defs/film" }
          }
        },
        "rewind": { "oneOf": [{ "$ref": "#/$defs/film" }, { "type": "null" }], "description": "The film reversed, played by Back." }
      }
    }
  }
}
