{
  "format": "sogni-world@1",
  "id": "the-long-white-cloud",
  "title": "The Long White Cloud",
  "subtitle": "A trip through Aotearoa New Zealand, told in our own photographs",
  "credit": "Photographs and voices by Mark and Jen, March–April 2023. Every film was rendered on the Sogni Supernet with MiniMax H3 (FastH3 first-and-last-frame, two-stage 2K), objects traced with Segment Anything 3, and narration spoken in cloned voices with Qwen3-TTS. Built by coding agents with a human approving every take.",
  "aspect": {
    "width": 2304,
    "height": 1536
  },
  "start": "round-door",
  "order": [
    "round-door",
    "forest-stage",
    "haka",
    "waiata",
    "sound-deck",
    "sound-together",
    "three-falls",
    "stirling-falls",
    "cloud-wall",
    "hot-pool",
    "red-car",
    "aoraki",
    "helipad",
    "glacier-poles",
    "that-way",
    "blue-ice",
    "glacier-walk",
    "hooker-valley",
    "hooker-bridge",
    "bridge-walk",
    "blue-beanie",
    "green-hills"
  ],
  "music": null,
  "speakers": {
    "Mark": {
      "avatar": "https://worlds.sogni.ai/the-long-white-cloud/speakers/mark.jpg"
    },
    "Jen": {
      "avatar": "https://worlds.sogni.ai/the-long-white-cloud/speakers/jen.jpg"
    }
  },
  "places": [
    {
      "id": "round-door",
      "title": "The Round Door",
      "chapter": "Hobbiton · Matamata",
      "caption": "Kia ora — hello, goodbye and thank you, all in two words.",
      "still": "https://worlds.sogni.ai/the-long-white-cloud/round-door-v2.jpg",
      "loop": {
        "src": "https://cdn.sogni.ai/sogni-world/v1/worlds/the-long-white-cloud/videos/round-door-loop-r2-2k.d3cd143c20c39b10cbbac0f3018236c78d8b3368ca07e9bec8d75ad85f1409ac.mp4",
        "src720": "https://cdn.sogni.ai/sogni-world/v1/worlds/the-long-white-cloud/videos/round-door-loop-r2.ef45e1a63668274033cdf9c91c9a1ef858ad61f0c3811bcf37185e77251fca1c.mp4",
        "seconds": 8
      },
      "narration": {
        "src": "https://cdn.sogni.ai/sogni-world/v1/worlds/the-long-white-cloud/narration/round-door.f7989abad81087c650161de24356387a21051bf0e19b157b9a804545eec45508.mp3",
        "lines": [
          {
            "text": "Kia ora!",
            "speaker": "Mark",
            "start": 0.349,
            "end": 1
          },
          {
            "text": "So this is Hobbiton, near Matamata, right near the end of our road trip.",
            "speaker": "Mark",
            "start": 1.602,
            "end": 5.457
          },
          {
            "text": "Everything here is hobbit-sized, so mind your head.",
            "speaker": "Mark",
            "start": 6.314,
            "end": 8.827
          }
        ]
      },
      "hotspots": [
        {
          "id": "door",
          "label": "Duck through the round door",
          "hint": "It opens a long way from a hallway",
          "at": [
            0.44,
            0.62
          ],
          "outline": {
            "width": 1536,
            "height": 1024,
            "path": "M737 432L789 435L790 437L819 441L832 448L831 453L821 463L819 476L812 478L819 480L821 493L825 499L828 519L826 522L806 530L794 546L795 560L791 575L789 599L795 613L795 621L801 627L808 648L804 654L795 658L792 663L788 663L789 667L778 676L773 685L755 702L761 716L758 737L764 750L772 757L772 776L770 781L774 787L774 794L778 798L779 807L785 816L783 824L789 824L789 819L793 818L798 821L799 827L802 829L802 836L806 832L813 833L816 842L814 852L803 861L796 858L757 864L702 864L673 867L626 864L613 858L599 859L595 855L584 855L571 844L568 838L552 833L545 828L535 818L533 813L536 806L533 800L536 796L543 796L544 800L548 801L550 795L552 795L550 791L556 790L557 786L561 789L566 789L567 793L569 793L569 788L567 787L570 787L571 782L574 781L572 778L574 773L571 772L570 762L567 760L570 755L567 754L562 757L549 749L554 746L551 740L555 738L552 735L555 734L555 728L551 727L554 723L550 721L554 716L549 712L549 705L544 703L544 700L548 699L549 690L544 688L549 687L550 690L553 689L547 680L554 675L553 670L558 665L558 662L549 654L543 654L539 661L535 661L535 658L539 656L534 654L536 650L534 646L535 634L531 631L530 627L538 628L545 626L548 622L546 616L549 615L547 611L542 615L538 612L530 614L532 608L537 607L532 605L534 595L543 589L538 586L540 576L543 575L541 569L547 564L545 559L549 557L560 533L577 516L581 507L592 499L595 493L610 480L618 477L626 469L635 466L641 460L646 459L648 456L654 457L663 449L673 444L720 437L728 433Z"
          },
          "to": "forest-stage",
          "next": true,
          "shortcut": false,
          "film": {
            "src": "https://cdn.sogni.ai/sogni-world/v1/worlds/the-long-white-cloud/videos/round-door-door-r3-2k.5d8c2316968bc4601bc605f2de671a06cc765c18a5eccf834f35104d47ecc52e.mp4",
            "src720": "https://cdn.sogni.ai/sogni-world/v1/worlds/the-long-white-cloud/videos/round-door-door-r3.8750afabaabe6ee251201da8936e43df22558c61c829ca2cae1129049fa3b4c5.mp4",
            "seconds": 12.25
          },
          "rewind": {
            "src": "https://cdn.sogni.ai/sogni-world/v1/rewinds/round-door-door-r3-2k.5d8c2316968bc4601bc605f2de671a06cc765c18a5eccf834f35104d47ecc52e.rewind.6907d06d77875d74b5d55702bcf5f8cbc8e49246d0b194af756c88ed1f005552.mp4",
            "seconds": 12.25
          }
        },
        {
          "id": "hill",
          "label": "Climb the hill over the door",
          "hint": "The Shire keeps going",
          "at": [
            0.5,
            0.26
          ],
          "outline": {
            "width": 1536,
            "height": 1024,
            "path": "M619 177L663 179L665 181L681 182L707 179L733 185L736 183L743 184L745 191L740 212L743 215L741 226L744 230L739 239L737 239L742 244L739 247L740 251L738 253L735 241L730 243L732 257L730 265L726 268L697 280L692 280L686 286L673 290L664 300L644 307L632 315L606 324L602 328L584 335L569 348L563 349L558 354L553 354L546 358L523 361L492 375L477 379L455 395L441 402L433 403L419 413L403 417L388 425L350 436L336 443L328 444L321 451L311 456L283 464L244 482L218 488L185 502L142 510L139 515L134 515L131 518L124 515L121 517L113 516L109 519L109 514L104 512L101 525L92 530L28 534L24 536L0 536L0 311L11 312L12 310L6 308L7 306L21 310L22 306L19 306L18 302L22 301L35 302L38 305L47 306L69 303L71 305L99 307L97 309L98 312L120 312L128 308L138 309L140 307L164 305L180 309L185 313L204 316L246 316L261 314L265 311L268 314L304 314L311 317L339 319L354 309L368 312L389 303L411 298L418 293L437 286L479 280L483 277L503 272L503 264L499 260L493 259L496 252L519 231L531 227L533 220L539 214L565 200L576 183L589 179ZM775 183L785 185L786 187L800 185L827 190L880 192L898 197L992 201L1010 206L1013 208L1015 215L1023 214L1026 217L1031 216L1026 213L1026 209L1033 210L1034 214L1032 216L1036 219L1025 220L1022 227L1017 229L1005 229L1014 232L1002 235L1003 240L1009 245L1019 245L1022 243L1027 246L1030 244L1029 240L1031 239L1042 247L1060 245L1066 240L1066 229L1072 223L1077 223L1078 218L1082 218L1088 223L1093 232L1090 237L1097 238L1096 244L1098 248L1106 253L1123 252L1143 239L1154 236L1166 237L1176 233L1189 221L1193 214L1226 214L1232 217L1242 217L1244 218L1243 220L1228 222L1228 230L1232 233L1220 239L1211 250L1200 251L1200 255L1208 255L1209 262L1197 265L1210 266L1218 275L1224 277L1236 277L1244 266L1254 266L1248 260L1253 258L1254 250L1250 246L1255 243L1255 240L1260 237L1267 240L1273 233L1292 227L1293 218L1298 214L1310 211L1314 215L1331 214L1335 218L1331 221L1323 221L1320 227L1314 227L1309 235L1304 236L1307 241L1321 241L1335 237L1340 229L1351 225L1351 218L1357 213L1363 216L1373 211L1397 208L1431 214L1435 216L1435 219L1429 226L1433 230L1433 234L1429 236L1431 241L1431 268L1438 269L1438 279L1441 288L1441 291L1432 294L1437 295L1441 299L1442 305L1430 308L1448 314L1447 319L1455 331L1453 340L1456 343L1456 354L1459 356L1464 368L1469 371L1468 376L1474 389L1473 397L1477 402L1477 404L1469 409L1465 409L1459 419L1462 421L1468 419L1475 421L1481 429L1494 438L1498 448L1504 454L1510 464L1510 468L1516 475L1514 482L1524 485L1524 493L1532 501L1533 505L1536 505L1536 537L1527 538L1525 541L1518 539L1499 540L1498 538L1490 538L1471 531L1415 529L1411 525L1327 514L1312 509L1299 500L1287 499L1277 492L1251 483L1245 483L1230 475L1203 467L1191 459L1181 457L1163 445L1117 427L1114 423L1094 415L1084 408L1062 400L1046 388L1021 379L1019 376L1006 373L998 367L989 365L982 359L965 352L960 347L926 333L915 322L856 298L832 281L795 269L789 263L787 256L782 254L782 250L778 254L775 253L773 243L776 236L773 225L776 215L775 206L778 203Z"
          },
          "to": "green-hills",
          "next": false,
          "shortcut": true,
          "film": {
            "src": "https://cdn.sogni.ai/sogni-world/v1/worlds/the-long-white-cloud/videos/round-door-hill-r2-2k.f5818ec3bbda9af119b8a2c405197c4e8ba96847f8a5ce04a38568e38d92812a.mp4",
            "src720": "https://cdn.sogni.ai/sogni-world/v1/worlds/the-long-white-cloud/videos/round-door-hill-r2.35e3d34769c7c061dcc68232a16bd8d30a39fe7f2391bf0a3ff483aafb9bf947.mp4",
            "seconds": 8
          },
          "rewind": {
            "src": "https://cdn.sogni.ai/sogni-world/v1/rewinds/round-door-hill-r2-2k.f5818ec3bbda9af119b8a2c405197c4e8ba96847f8a5ce04a38568e38d92812a.rewind.08e01c508b96cac132254762bb47f76f2a3cb65ce4d35316cee28686c0422cd9.mp4",
            "seconds": 8
          }
        }
      ]
    },
    {
      "id": "forest-stage",
      "title": "The Challenge",
      "chapter": "Te Pā Tū · Rotorua",
      "caption": "Stand still. This is how a welcome begins.",
      "still": "https://worlds.sogni.ai/the-long-white-cloud/forest-stage.jpg",
      "loop": {
        "src": "https://cdn.sogni.ai/sogni-world/v1/worlds/the-long-white-cloud/videos/forest-stage-loop-r1-2k.5aaf8190644b026445693fad80c533923d10091f865323e8e070596507d613ff.mp4",
        "src720": "https://cdn.sogni.ai/sogni-world/v1/worlds/the-long-white-cloud/videos/forest-stage-loop-r1.a10b999866d394a9c7f3171b248f50406fcf1296d1dc6cd96fa1572171663069.mp4",
        "seconds": 8
      },
      "narration": {